Идентификатор DOI *;Количество авторов *;Фамилия *;Имя *;Количество аффилиаций *;Аффиляция *;Контрибьюция *;Дата публикации *;Наименование публикации *;Наименование издания *;Библиографическая ссылка *;Вид издания  *
10.1070/QEL17641;10;;;2;Moscow Polytech Univ, Russian Acad Sci;0.05;NOV 2021;Investigation of spatial and temporal characteristics of turbulent-distorted laser radiation during its dynamic phase correction in an adaptive optical system;QUANTUM ELECTRONICS;"Belousov, V. N.; Bogachev, V. A.; Volkov, M. V.; Garanin, S. G.; Kudryashov, A., V; Nikitin, A. N.; Rukosuev, A. L.; Starikov, F. A.; Sheldakova, Yu, V; Shnyagin, R. A. Investigation of spatial and temporal characteristics of turbulent-distorted laser radiation during its dynamic phase correction in an adaptive optical system 2021 QUANTUM ELECTRONICS, 51 (11), pp. 992-999";Статья
10.1134/S1064226921120093;4;;;1;Moscow Polytech Univ;0.25;DEC 2021;Dynamic Programming on the Multidimensional Grid and Fast Search Algorithm for Energy Minimization in Stereo and Optical Flow;JOURNAL OF COMMUNICATIONS TECHNOLOGY AND ELECTRONICS;"Karnaukhov, V. N.; Kober, V., I; Mozerov, M. G.; Zimina, L., V Dynamic Programming on the Multidimensional Grid and Fast Search Algorithm for Energy Minimization in Stereo and Optical Flow 2021 JOURNAL OF COMMUNICATIONS TECHNOLOGY AND ELECTRONICS, 66 (12), pp. 1424-1437";Статья
10.1134/S106422692112010X;4;;;1;Moscow Polytech Univ;0.25;DEC 2021;Robust Stereo Matching Using Phase Features Based on the Walsh-Hadamard Transform;JOURNAL OF COMMUNICATIONS TECHNOLOGY AND ELECTRONICS;"Karnaukhov, V. N.; Kober, V., I; Mozerov, M. G.; Zimina, L., V Robust Stereo Matching Using Phase Features Based on the Walsh-Hadamard Transform 2021 JOURNAL OF COMMUNICATIONS TECHNOLOGY AND ELECTRONICS, 66 (12), pp. 1438-1443";Статья
10.31166/VoprosyIstorii202110Statyi40;2;Machach;Vagabov M.;1;Moscow Polytech Univ;0.5;2021;On the use of fiction in the process of studying the history of Russia on the example of the Great Patriotic War;VOPROSY ISTORII;"Machach, Vagabov M.; Abidat, Gazieva A. On the use of fiction in the process of studying the history of Russia on the example of the Great Patriotic War 2021 VOPROSY ISTORII, 10 (2), pp. 194-200";Статья
10.31166/VoprosyIstorii202109Statyi47;5;Fomicheva, Arzamasova;Lilia M., Ekaterina L.;1;Moscow Polytech Univ;0.6;2021;History of the development of economic analysis and economic psychology;VOPROSY ISTORII;"Arkhangel'skii, Alexander, I; Shchennikova, Valeriya N.; Fomicheva, Lilia M.; Gribov, Pavel G.; Arzamasova, Ekaterina L. History of the development of economic analysis and economic psychology 2021 VOPROSY ISTORII, 9 (2), pp. 164-170";Статья
10.3390/app112412112;6;Kudryashov;Alexis;2;Moscow Polytech Univ, Russian Acad Sci;0.08;DEC 2021;Expansion of the Laser Beam Wavefront in Terms of Zernike Polynomials in the Problem of Turbulence Testing;APPLIED SCIENCES-BASEL;"Rukosuev, Alexey; Nikitin, Alexander; Belousov, Vadim; Sheldakova, Julia; Toporovsky, Vladimir; Kudryashov, Alexis Expansion of the Laser Beam Wavefront in Terms of Zernike Polynomials in the Problem of Turbulence Testing 2021 APPLIED SCIENCES-BASEL, 11 (24), Статья № 12112";Статья
10.1134/S1063783421070064;2;Erokhin;K. M.;1;Moscow Polytech Univ;0.5;JUL 2021;Relationships of Macroscopic Characteristics of a Solid with the Binding Energy of an Ion in a Metal Lattice;PHYSICS OF THE SOLID STATE;"Erokhin, K. M.; Kalashnikov, N. P. Relationships of Macroscopic Characteristics of a Solid with the Binding Energy of an Ion in a Metal Lattice 2021 PHYSICS OF THE SOLID STATE, 63 (7), pp. 973-977";Статья
10.3103/S1052618821060133;4;Petrov;P. A.;1;Moscow Polytech Univ;0.5;NOV 2021;Controlling Shape Formation of Workpieces From Titanium Alloys (as Exemplified by the OT4-1 Alloy) Using Simulation of Rheology and Regimes of Deformation;JOURNAL OF MACHINERY MANUFACTURE AND RELIABILITY;"Petrov, P. A.; Khanh Toan Nguyen; Burlakov, I. A.; Sukhorukov, R. Yu Controlling Shape Formation of Workpieces From Titanium Alloys (as Exemplified by the OT4-1 Alloy) Using Simulation of Rheology and Regimes of Deformation 2021 JOURNAL OF MACHINERY MANUFACTURE AND RELIABILITY, 50 (6), pp. 547-553";Статья
10.3103/S1052618821060121;2;Korol'kov;O. E.;1;Moscow Polytech Univ;0.5;NOV 2021;Study and Application of an Electric Current for Medical Implants;JOURNAL OF MACHINERY MANUFACTURE AND RELIABILITY;"Korol'kov, O. E.; Stolyarov, V. V. Study and Application of an Electric Current for Medical Implants 2021 JOURNAL OF MACHINERY MANUFACTURE AND RELIABILITY, 50 (6), pp. 554-561";Статья
10.53350/pjmhs211592651;3;Polevoy;G. G.;3;Moscow Polytech Univ, Natl Res Univ, Vyatka State Univ;0.78;SEP 2021;Development of coordination abilities of football players taking into account the strength of their nervous system;PAKISTAN JOURNAL OF MEDICAL & HEALTH SCIENCES;"Polevoy, G. G.; Egorycheva, E., V; Fedorov, A., V Development of coordination abilities of football players taking into account the strength of their nervous system 2021 PAKISTAN JOURNAL OF MEDICAL & HEALTH SCIENCES, 15 (9), pp. 2651-2655";Статья
10.9756/INT-JECSE/V13I2.211160;6;Livson;Maya;1;Moscow Polytech Univ;0.17;DEC 2021;Influence of Digital Assistive Technologies Used in Higher Education on the Development of Individual Educational Strategies among Students with Disabilities;INTERNATIONAL JOURNAL OF EARLY CHILDHOOD SPECIAL EDUCATION;"Aleksandrova, Irina Borisovna; Vorobyova, Klarisa Ivanovna; Gileva, Nataliya Vladimirovna; Livson, Maya; Cheprasova, T., V; Bazhin, Grigoriy Mikhailovich Influence of Digital Assistive Technologies Used in Higher Education on the Development of Individual Educational Strategies among Students with Disabilities 2021 INTERNATIONAL JOURNAL OF EARLY CHILDHOOD SPECIAL EDUCATION, 13 (2), pp. 1146-1153";Статья
10.17081/just.26.40.4773;5;Dmitriyevich Sekerin;Vladimir;1;Moscow Polytech Univ;0.2;JUL-DEC 2021;Alternative Dispute Resolution Mechanisms in Colombia and Russia: Conciliation and Mediation;JUSTICIA;"Arrieta Lopez, Milton; Meza Godoy, Abel; Vladimirovich Afanasiev, Ilya; Dmitriyevich Sekerin, Vladimir; Noli, Sara Alternative Dispute Resolution Mechanisms in Colombia and Russia: Conciliation and Mediation 2021 JUSTICIA, 26 (40), pp. 128-142";Статья
10.34069/AI/2021.46.10.1;3;Pitelinskiy, Pitelinskiy;Kirill V., Kirill V.;1;Moscow Polytech Univ;0.33;NOV 2021;Features of enterprise risk management associated with operational risks;AMAZONIA INVESTIGA;"Boyar-Sozonovitch, Andrey S.; Buikin, Alexey Yu.; Pitelinskiy, Kirill V. Features of enterprise risk management associated with operational risks 2021 AMAZONIA INVESTIGA, 10 (46), pp. 9-19";Статья
10.3390/en14206661;8;Denisov;Aleksandr Dmitrievich;1;Moscow Polytech Univ;0.12;OCT 2021;Investigation of the Performances of a Diesel Engine Operating on Blended and Emulsified Biofuels from Rapeseed Oil;ENERGIES;"Markov, Vladimir Anatolyevich; Sa, Bowen; Devyanin, Sergey Nikolaevich; Zherdev, Anatoly Anatolyevich; Maldonado, Pablo Ramon Vallejo; Zykov, Sergey Anatolyevich; Denisov, Aleksandr Dmitrievich; Ambawatte, Hewage Chithral Investigation of the Performances of a Diesel Engine Operating on Blended and Emulsified Biofuels from Rapeseed Oil 2021 ENERGIES, 14 (20), Статья № 6661";Статья
10.3390/life11101034;4;Karlov;Sergei P.;1;Moscow Polytech Univ;0.25;OCT 2021;Water-Sulfuric Acid Foam as a Possible Habitat for Hypothetical Microbial Community in the Cloud Layer of Venus;LIFE-BASEL;"Skladnev, Dmitry A.; Karlov, Sergei P.; Khrunyk, Yuliya Y.; Kotsyurbenko, Oleg R. Water-Sulfuric Acid Foam as a Possible Habitat for Hypothetical Microbial Community in the Cloud Layer of Venus 2021 LIFE-BASEL, 11 (10), Статья № 1034";Статья
10.3991/ijet.v16i21.25675;6;Otts, Panova, Lobanova;Ekaterina Viktorovna, Elena Pavlovna, Yuliya Vladimirovna;1;Moscow Polytech Univ;0.5;2021;Modification of the Role of a Teacher Under the Conditions of Distance Learning;INTERNATIONAL JOURNAL OF EMERGING TECHNOLOGIES IN LEARNING;"Otts, Ekaterina Viktorovna; Panova, Elena Pavlovna; Lobanova, Yuliya Vladimirovna; Bocharnikova, Natalya Victorovna; Panfilova, Valentina Michailovna; Panfilov, Aleksey Nikolaevich Modification of the Role of a Teacher Under the Conditions of Distance Learning 2021 INTERNATIONAL JOURNAL OF EMERGING TECHNOLOGIES IN LEARNING, 16 (21), pp. 219-225";Статья
10.1108/K-05-2021-0378;7;Saenko;Natalya Ryafikovna;1;Moscow Polytech Univ;0.14;MAY 17 2022;A new trust management framework based on the experience of users in industrial cloud computing using multi-criteria decision making;KYBERNETES;"Khoruzhy, Liudmila Ivanovna; Bulyga, Roman Petrovich; Voronkova, Olga Yuryevna; Vasyutkina, Lidia Vladimirovna; Saenko, Natalya Ryafikovna; Poltarykhin, Andrey Leonidovich; Aravindhan, Surendar A new trust management framework based on the experience of users in industrial cloud computing using multi-criteria decision making 2022 KYBERNETES, 51 (6), pp. 1949-1966";Статья
;5;Bezkorovaynaya;Galina Tigranovna;1;Moscow Polytech Univ;0.2;2021;INTERROGATIVE IN THE HUMANITIES AND LINGUISTICS: THE EPISTEMOLOGY OF RESEARCH;REVISTA ENTRELINGUAS;"Sedykh, Arkadiy Petrovich; Sidorova, Tatyana Alexandrovna; Akimova, Elvira Nikolajevna; Bezkorovaynaya, Galina Tigranovna; Skvortsov, Konstantin Viktorovich INTERROGATIVE IN THE HUMANITIES AND LINGUISTICS: THE EPISTEMOLOGY OF RESEARCH 2021 REVISTA ENTRELINGUAS, 7, Статья № e021083";Статья
10.1134/S0020441221060130;3;Varlamov, Kuksa;D. O., V. V.;1;Moscow Polytech Univ;0.67;NOV 2021;Analysis of the Characteristics of a Laser Lighting Device;INSTRUMENTS AND EXPERIMENTAL TECHNIQUES;"Zuev, S. M.; Varlamov, D. O.; Kuksa, V. V. Analysis of the Characteristics of a Laser Lighting Device 2021 INSTRUMENTS AND EXPERIMENTAL TECHNIQUES, 64 (6), pp. 834-839";Статья
10.1007/s10556-021-00976-z;2;Ugolnikova, Chernyavskaya;M. A., V. V.;1;Moscow Polytech Univ;1.0;NOV 2021;Dynamics of Water Ice Formation during the Operation of Vessel Cryoconcentrators;CHEMICAL AND PETROLEUM ENGINEERING;"Ugolnikova, M. A.; Chernyavskaya, V. V. Dynamics of Water Ice Formation during the Operation of Vessel Cryoconcentrators 2021 CHEMICAL AND PETROLEUM ENGINEERING, 57 (7-8), pp. 561-566";Статья
10.1007/s11015-021-01224-8;4;;;1;Moscow Polytech Univ;0.25;NOV 2021;Increasing the Stability of Mechanical Properties of Semifinished Products from Ti-6Al-4V Alloys by Correcting the Alloying Range and Annealing Modes;METALLURGIST;"Egorova, Yu B.; Skvortsova, S., V; Chibisova, E., V; Davydenko, L., V Increasing the Stability of Mechanical Properties of Semifinished Products from Ti-6Al-4V Alloys by Correcting the Alloying Range and Annealing Modes 2021 METALLURGIST, 65 (7-8), pp. 872-885";Статья
10.1007/s11182-021-02458-4;1;Skobelev;V. V.;1;Moscow Polytech Univ;1.0;NOV 2021;Spatial Electron Transitions in a Hydrogen-Like Atom with Photon Emission;RUSSIAN PHYSICS JOURNAL;Skobelev, V. V. Spatial Electron Transitions in a Hydrogen-Like Atom with Photon Emission 2021 RUSSIAN PHYSICS JOURNAL, 64 (7), pp. 1328-1336;Статья
10.1016/j.jallcom.2021.162540;4;Golovin;I. S.;2;Moscow Polytech Univ, Natl Univ Sci & Technol MISIS;0.12;FEB 25 2022;Coherent cluster ordering in Fe-xAl and Fe-xGa alloys;JOURNAL OF ALLOYS AND COMPOUNDS;"Balagurov, A. M.; Bobrikov, I. A.; Sumnikov, S. V.; Golovin, I. S. Coherent cluster ordering in Fe-xAl and Fe-xGa alloys 2022 JOURNAL OF ALLOYS AND COMPOUNDS, 895, Статья № 162540";Статья
10.1007/s11223-021-00316-9;3;Bondar, Abashev, Petrov;V. S., D. R., V. K.;1;Moscow Polytech Univ;1.0;JUL 2021;Construction of the Theory of Plasticity Irrelative of the Loading Surface and Associated Flow Law;STRENGTH OF MATERIALS;"Bondar, V. S.; Abashev, D. R.; Petrov, V. K. Construction of the Theory of Plasticity Irrelative of the Loading Surface and Associated Flow Law 2021 STRENGTH OF MATERIALS, 53 (4), pp. 550-558";Статья
10.21003/ea.V187-22;5;Golubev, Efremov, Gorokhova;Sergei, Andrey, Anna;1;Moscow Polytech Univ;0.6;FEB 28 2021;Development of the scientific and technological forecasting methodology based on using TIPS instruments;ECONOMIC ANNALS-XXI;"Golubev, Sergei; Efremov, Andrey; Gorokhova, Anna; Gayduk, Vladimir; Kravets, Ekaterina Development of the scientific and technological forecasting methodology based on using TIPS instruments 2021 ECONOMIC ANNALS-XXI, 187 (1-2), pp. 223-231";Статья
10.9734/JPRI/2021/v33i48A33236;6;Krekova;Marina Mikhailovna;1;Moscow Polytech Univ;0.17;2021;Allergic Reaction of the Body to Drugs Used in Dental Practice;JOURNAL OF PHARMACEUTICAL RESEARCH INTERNATIONAL;"Shefova, Anastasiia Vladimirovna; Galustyan, Andrey Olegovich; Shershneva, Angelina Olegovna; Tyukavina, Olga Vladimirovna; Krekova, Marina Mikhailovna; Markov, Alexander Allergic Reaction of the Body to Drugs Used in Dental Practice 2021 JOURNAL OF PHARMACEUTICAL RESEARCH INTERNATIONAL, 33 (48A), Статья № 76209, pp. 182-187";Статья
10.18799/24131830/2021/10/3394;4;;;1;Moscow Polytech Univ;0.25;2021;ANALYSIS OF ELECTRIC POWER LOSS IN THE POWER SUPPLY SYSTEM OF THE CONCENTRATING FACTORY;BULLETIN OF THE TOMSK POLYTECHNIC UNIVERSITY-GEO ASSETS ENGINEERING;"Klyuev, Roman, V; Golik, Vladimir, I; Bosikov, Igor I.; Gavrina, Oksana A. ANALYSIS OF ELECTRIC POWER LOSS IN THE POWER SUPPLY SYSTEM OF THE CONCENTRATING FACTORY 2021 BULLETIN OF THE TOMSK POLYTECHNIC UNIVERSITY-GEO ASSETS ENGINEERING, 332 (10), pp. 7-16";Статья
10.29333/iji.2021.14430a;5;Saenko;Natalya;1;Moscow Polytech Univ;0.2;OCT 2021;Organizing Students' Independent Work at Universities for Professional Competencies Formation and Personality Development;INTERNATIONAL JOURNAL OF INSTRUCTION;"Tsvetkova, Milena; Saenko, Natalya; Levina, Victoria; Kondratenko, Larisa; Khimmataliev, Dustnazar Organizing Students' Independent Work at Universities for Professional Competencies Formation and Personality Development 2021 INTERNATIONAL JOURNAL OF INSTRUCTION, 14 (4), pp. 503-528";Статья
10.46398/cuestpol.3970.36;5;Gridchina;Alexandra Vl.;1;Moscow Politech Univ;0.2;2021;Problem of lawyer protection: comparative legal analysis;CUESTIONES POLITICAS;"Turanin, Vladislav Yu.; Gridchina, Alexandra Vl.; Kutina, Vera P.; Umarova, Amala A.; Dolgov, Stanislav F. Problem of lawyer protection: comparative legal analysis 2021 CUESTIONES POLITICAS, 39 (70), pp. 607-616";Статья
10.1007/s10692-021-10255-5;2;Nazarov;V. G.;1;Moscow Polytech Univ;1.0;JUL 2021;Influence of the Processing Mode of Nonwoven Needle-Punched Materials on Air Filtration;FIBRE CHEMISTRY;"Nazarov, V. G.; Dedov, A., V Influence of the Processing Mode of Nonwoven Needle-Punched Materials on Air Filtration 2021 FIBRE CHEMISTRY, 53 (2), pp. 143-148";Статья
10.9734/JPRI/2021/v33i46B32936;5;Krekova;Marina Mikhailovna;1;Moscow Polytech Univ;0.2;2021;Disorders of the Immune System and Susceptibility to Various Diseases in Children with Diabetes Mellitus;JOURNAL OF PHARMACEUTICAL RESEARCH INTERNATIONAL;"Mekhtieva, Seda Vakhaevna; Ismailov, Magomedbeg Salahudinovich; Pavlov, Bogdan Vladimirovich; Krekova, Marina Mikhailovna; Papinyan, David Robertovich Disorders of the Immune System and Susceptibility to Various Diseases in Children with Diabetes Mellitus 2021 JOURNAL OF PHARMACEUTICAL RESEARCH INTERNATIONAL, 33 (46B), Статья № 75703, pp. 218-223";Статья
;5;Gorshkova;Elena A.;1;Moscow Politech Univ;0.2;OCT 2021;Legal regulation of rational energy production and consumption in Russia and other states;NEXO REVISTA CIENTIFICA;"Tonkov, Evgeniy E.; Turanin, Vladislav Yu; Lilikova, Oksana S.; Staroseltseva, Marina M.; Gorshkova, Elena A. Legal regulation of rational energy production and consumption in Russia and other states 2021 NEXO REVISTA CIENTIFICA, 34 (4), pp. 1243-1249";Статья
10.1016/j.measurement.2021.110270;3;Petrov;Pavel A.;1;Moscow Polytech Univ;0.33;JAN 2022;Determination of temperature distribution in cold forging with the support of inverse analysis;MEASUREMENT;"Dixit, Uday S.; Raj, Amit; Petrov, Pavel A. Determination of temperature distribution in cold forging with the support of inverse analysis 2022 MEASUREMENT, 187, Статья № 110270";Статья
10.9734/JPRI/2021/v33i45A32728;6;Krekova;Marina Mikhailovna;1;Moscow Polytech Univ;0.17;2021;The Role of Orthodontic Treatment and Prosthetics during the Recovery Period after Surgical Treatment;JOURNAL OF PHARMACEUTICAL RESEARCH INTERNATIONAL;"Kadiyev, Timerlan Aslambekovich; Aigumov, Muslim Kazbekovich; Timokhina, Tatyana; Baranov, Kirill Dmitrievich; Krekova, Marina Mikhailovna; Goncharov, Vitaly V. The Role of Orthodontic Treatment and Prosthetics during the Recovery Period after Surgical Treatment 2021 JOURNAL OF PHARMACEUTICAL RESEARCH INTERNATIONAL, 33 (45A), Статья № 74671, pp. 156-162";Статья
10.24412/2071-6168-2021-3-227-236;1;Ta;Tran Trung;1;Moscow Polytech Univ;1.0;2021;INCREASING RELIABILITY OF THE ROBOTIC ASSEMBLY PROCESS OF THE CYLINDRICAL JOINTS USING EFFECT OF ROTATION AND LOW-FREQUENCY VIBRATION;PROCEEDINGS OF THE TULA STATES UNIVERSITY-SCIENCES OF EARTH;Ta, Tran Trung INCREASING RELIABILITY OF THE ROBOTIC ASSEMBLY PROCESS OF THE CYLINDRICAL JOINTS USING EFFECT OF ROTATION AND LOW-FREQUENCY VIBRATION 2021 PROCEEDINGS OF THE TULA STATES UNIVERSITY-SCIENCES OF EARTH, 3, pp. 227-236;Статья
10.24412/2071-6168-2021-3-358-365;6;Orlova, Sultanova;E. Yu, Yu M.;1;Moscow Polytech Univ;0.5;2021;APPROACHES TO PREDICTING THE INTERACTION OF COMPONENTS IN PRINTING SYSTEM;PROCEEDINGS OF THE TULA STATES UNIVERSITY-SCIENCES OF EARTH;"Orlova, E. Yu; Chernaya, I., V; Sultanova, Yu M.; Varepo, L. G.; Trapeznikova, O., V; Rovenskikh, A. A. APPROACHES TO PREDICTING THE INTERACTION OF COMPONENTS IN PRINTING SYSTEM 2021 PROCEEDINGS OF THE TULA STATES UNIVERSITY-SCIENCES OF EARTH, 3, pp. 358-365";Статья
10.24412/2071-6168-2021-3-365-370;4;Wilkova, Shaimardanov, Bablyuk;E. A., E. G., E. B.;1;Moscow Polytech Univ;0.75;2021;FEATURES OF THE DESIGN OF EQUIPMENT FOR THE PROCESSING OF POLYMER FILMS IN PRINTING ELECTRONICS;PROCEEDINGS OF THE TULA STATES UNIVERSITY-SCIENCES OF EARTH;"Chizhenko, A., V; Wilkova, E. A.; Shaimardanov, E. G.; Bablyuk, E. B. FEATURES OF THE DESIGN OF EQUIPMENT FOR THE PROCESSING OF POLYMER FILMS IN PRINTING ELECTRONICS 2021 PROCEEDINGS OF THE TULA STATES UNIVERSITY-SCIENCES OF EARTH, 3, pp. 365-370";Статья
10.24412/2071-6168-2021-3-373-378;2;Sigaeva, Kornilov;E. A., I. K.;1;Moscow Polytech Univ;1.0;2021;ENVIRONMENTAL EVALUATION OF PRINTING EQUIPMENT;PROCEEDINGS OF THE TULA STATES UNIVERSITY-SCIENCES OF EARTH;"Sigaeva, E. A.; Kornilov, I. K. ENVIRONMENTAL EVALUATION OF PRINTING EQUIPMENT 2021 PROCEEDINGS OF THE TULA STATES UNIVERSITY-SCIENCES OF EARTH, 3, pp. 373-378";Статья
10.1007/s11182-021-02438-8;1;Kopylov;S. V.;1;Moscow Polytech Univ;1.0;OCT 2021;VOLUME OPERATOR;RUSSIAN PHYSICS JOURNAL;Kopylov, S. V. VOLUME OPERATOR 2021 RUSSIAN PHYSICS JOURNAL, 64 (6), pp. 1171-1173;Статья
10.1016/j.aml.2021.107731;2;Polyanin;Andrei D.;2;Moscow Polytech Univ, Russian Acad Sci;0.25;MAR 2022;Reductions and exact solutions of Lotka-Volterra and more complex reaction-diffusion systems with delays;APPLIED MATHEMATICS LETTERS;"Polyanin, Andrei D.; Sorokin, Vsevolod G. Reductions and exact solutions of Lotka-Volterra and more complex reaction-diffusion systems with delays 2022 APPLIED MATHEMATICS LETTERS, 125, Статья № 107731";Статья
10.1016/j.jallcom.2021.162262;10;Golovin;I. S.;2;Moscow Polytech Univ, Natl Univ Sci & Technol MISIS;0.05;FEB 10 2022;Enhancement of the magneto-mechanical properties in directional solidified Fe80Al20 alloys by doping Tb;JOURNAL OF ALLOYS AND COMPOUNDS;"Chang, H. W.; Jen, S. U.; Liao, Y. H.; Tseng, D. H.; Hsieh, H. Y.; Chang, W. C.; Chiu, C. H.; Cifre, J.; Chubov, D. G.; Golovin, I. S. Enhancement of the magneto-mechanical properties in directional solidified Fe80Al20 alloys by doping Tb 2022 JOURNAL OF ALLOYS AND COMPOUNDS, 893, Статья № 162262";Статья
10.1016/j.jallcom.2021.161782;6;Mohamed, Golovin;A. K., I. S.;2;Moscow Polytech Univ, Natl Univ Sci & Technol MISIS;0.17;DEC 31 2021;Structure evolution of as-cast metastable Fe-38Ga alloy towards equilibrium;JOURNAL OF ALLOYS AND COMPOUNDS;"Vershinina, T. N.; Bobrikov, I. A.; Sumnikov, S., V; Balagurov, A. M.; Mohamed, A. K.; Golovin, I. S. Structure evolution of as-cast metastable Fe-38Ga alloy towards equilibrium 2021 JOURNAL OF ALLOYS AND COMPOUNDS, 889, Статья № 161782";Статья
10.1134/S2075113321010275;2;Nazarov, Dedov;V. G., A. V.;1;Moscow Polytech Univ;1.0;JAN 2021;Effect of Protective Coating on Extraction of Plasticizer from Polyvinyl Chloride;INORGANIC MATERIALS-APPLIED RESEARCH;"Nazarov, V. G.; Dedov, A. V. Effect of Protective Coating on Extraction of Plasticizer from Polyvinyl Chloride 2021 INORGANIC MATERIALS-APPLIED RESEARCH, 12 (1), pp. 190-194";Статья
10.24425/afe.2021.138667;5;Golubev, Sekerin, Gorokhova, Shevchenko;S. S., V. D., A. E., D. A.;1;Moscow Polytech Univ;0.8;2021;Ferrous Metallurgy Production in Russia: How Will the COVID-19 Pandemic Affect?;ARCHIVES OF FOUNDRY ENGINEERING;"Golubev, S. S.; Sekerin, V. D.; Gorokhova, A. E.; Shevchenko, D. A.; Gusov, A. Z. Ferrous Metallurgy Production in Russia: How Will the COVID-19 Pandemic Affect? 2021 ARCHIVES OF FOUNDRY ENGINEERING, 21 (3), pp. 65-69";Статья
10.1007/s11015-021-01193-y;4;Latypov;R. A.;1;Moscow Polytech Univ;0.25;SEP 2021;Utilization of the Wastes of Mechanical Engineering and Metallurgy in the Process of Hardening and Restoration of Machine Parts. Part 1;METALLURGIST;"Latypov, R. A.; Serov, A., V; Serov, N., V; Ignatkin, I. Yu Utilization of the Wastes of Mechanical Engineering and Metallurgy in the Process of Hardening and Restoration of Machine Parts. Part 1 2021 METALLURGIST, 65 (5-6), pp. 578-585";Статья
10.13187/bg.2021.3.1162;3;Vagabov, Rogozhkin;Machach M., Vasily A.;1;Moscow Polytech Univ;0.67;SEP 1 2021;The Left Flank of the Caucasian Cordon Line: the Place and Role of Fortifications in the Military-Political Subordination of the Eastern Caucasus during the Caucasian War;BYLYE GODY;"Vagabov, Machach M.; Gazieva, Abidat A.; Rogozhkin, Vasily A. The Left Flank of the Caucasian Cordon Line: the Place and Role of Fortifications in the Military-Political Subordination of the Eastern Caucasus during the Caucasian War 2021 BYLYE GODY, 16 (3), pp. 1162-1170";Статья
10.1007/s10832-021-00269-0;4;Skvortsov, Luk'yanov, Chebeneva, Skvortsova;Arkadiy A., Mikhail N., Irina E., Anna A.;1;Moscow Polytech Univ;1.0;DEC 2021;Porous ceramics based on diatomite: Mechanical properties and evolution of morphology after deformation;JOURNAL OF ELECTROCERAMICS;"Skvortsov, Arkadiy A.; Luk'yanov, Mikhail N.; Chebeneva, Irina E.; Skvortsova, Anna A. Porous ceramics based on diatomite: Mechanical properties and evolution of morphology after deformation 2021 JOURNAL OF ELECTROCERAMICS, 47 (4), pp. 119-123";Статья
10.1007/s11015-021-01185-y;4;Artamonova, Ivanov;I. V., S. S.;1;Moscow Polytech Univ;0.5;SEP 2021;Steel Corrosion in Hydrogen Sulfide Containing Oil Field Model Media;METALLURGIST;"Guzenkova, A. S.; Artamonova, I. V.; Guzenkov, S. A.; Ivanov, S. S. Steel Corrosion in Hydrogen Sulfide Containing Oil Field Model Media 2021 METALLURGIST, 65 (5-6), pp. 517-521";Статья
10.1007/s11015-021-01203-z;3;Shatalov, Pham, Tran;R. L., V. H., V. Q.;1;Moscow Polytech Univ;1.0;SEP 2021;Influence of Lubricants and Contact Pressure Models on the Rolling Power along Thin Aluminum Stripes;METALLURGIST;"Shatalov, R. L.; Pham, V. H.; Tran, V. Q. Influence of Lubricants and Contact Pressure Models on the Rolling Power along Thin Aluminum Stripes 2021 METALLURGIST, 65 (5-6), pp. 660-672";Статья
10.1007/s11015-021-01206-w;4;Latypov;R. A.;1;Moscow Polytech Univ;0.25;SEP 2021;Utilization of the Wastes of Mechanical Engineering and Metallurgy in the Process of Hardening and Restoration of Machine Parts. Part 2;METALLURGIST;"Latypov, R. A.; Serov, A. V.; Serov, N. V.; Ignatkin, I. Yu. Utilization of the Wastes of Mechanical Engineering and Metallurgy in the Process of Hardening and Restoration of Machine Parts. Part 2 2021 METALLURGIST, 65 (5-6), pp. 689-695";Статья
10.3390/informatics8030046;4;Suvorov;Stanislav Vadimovich;1;Moscow Polytech Univ;0.25;SEP 2021;Evaluation of the Forms of Education of High School Students Using a Hybrid Model Based on Various Optimization Methods and a Neural Network;INFORMATICS-BASEL;"Dogadina, Elena Petrovna; Smirnov, Michael Viktorovich; Osipov, Aleksey Viktorovich; Suvorov, Stanislav Vadimovich Evaluation of the Forms of Education of High School Students Using a Hybrid Model Based on Various Optimization Methods and a Neural Network 2021 INFORMATICS-BASEL, 8 (3), Статья № 46";Статья
10.1070/QEL17542;9;;;2;Moscow Polytech Univ, Russian Acad Sci;0.06;JUL 2021;Adaptive system for correcting optical aberrations of high-power lasers with dynamic determination of the reference wavefront;QUANTUM ELECTRONICS;"Kotov, A., V; Perevalov, S. E.; Starodubtsev, M., V; Zemskov, R. S.; Alexandrov, A. G.; Galaktionov, I., V; Kudryashov, A., V; Samarkin, V. V.; Soloviev, A. A. Adaptive system for correcting optical aberrations of high-power lasers with dynamic determination of the reference wavefront 2021 QUANTUM ELECTRONICS, 51 (7), pp. 593-596";Статья
